{"schemaVersion":"1.0","traceId":"redacted-phase-2b-architecture-discovery","algorithm":{"name":"progresstrace-evaluator","version":"1.0.0"},"obligationResults":[{"obligationId":"architecture-discovery","classification":"progress","evidenceEventIds":["event-001","event-002"]}],"traceClassification":"progress"}
