{"schemaVersion":"1.0","traceId":"redacted-phase-2b-semantic-review-and-integration","algorithm":{"name":"progresstrace-evaluator","version":"1.0.0"},"obligationResults":[{"obligationId":"semantic-review","classification":"progress","evidenceEventIds":["event-001"]},{"obligationId":"integration","classification":"progress","evidenceEventIds":["event-002"]},{"obligationId":"hosted-verification","classification":"progress","evidenceEventIds":["event-003"]}],"traceClassification":"progress"}
