{"schemaVersion":"1.0","traceId":"redacted-phase-2b-codex-build-path-policy-recovery","algorithm":{"name":"progresstrace-evaluator","version":"1.0.0"},"obligationResults":[{"obligationId":"implementation","classification":"progress","evidenceEventIds":["event-001","event-002"]},{"obligationId":"path-policy","classification":"regression","evidenceEventIds":["event-001","event-002"]}],"traceClassification":"regression"}
