{"schemaVersion":"1.0","traceId":"redacted-phase-2b-codex-repair","algorithm":{"name":"progresstrace-evaluator","version":"1.0.0"},"obligationResults":[{"obligationId":"implementation","classification":"progress","evidenceEventIds":["event-001"]},{"obligationId":"path-policy","classification":"progress","evidenceEventIds":["event-001","event-002"]}],"traceClassification":"progress"}
